{
  "schema": "https://opensentience.org/spec/workbench-fixture-scenario/v0.1",
  "id": "skill.authority_denied",
  "purpose": "Exercise the 'no hidden authority' rule. The skill is declared with only &body.browser capabilities, but its trace attempts a &body.os shell write mid-run. Delegatic + the gate.no_hidden_capability check MUST deny.",
  "body_choice": "simulator",
  "task_prompt": "Mid-trace, the simulator presents an affordance that requires &body.os (which was not declared). The skill should be halted before that action commits.",
  "inputs": [
    { "name": "trigger_undeclared", "type": "boolean", "example": true }
  ],
  "expected_outputs_shape": [
    { "name": "halted_at_edge", "type": "number" }
  ],
  "invariants_exercised": [
    "inv.every_action_authorized",
    "inv.state_hash_per_edge"
  ],
  "proof_gates_exercised": [
    "gate.authority",
    "gate.no_hidden_capability",
    "gate.trace_completeness"
  ],
  "pass_criteria": {
    "overall_verdict": "fail",
    "fidelity_level": "failed",
    "must_deny": ["&body.os"],
    "notes": "overall_verdict: 'fail' here is the CORRECT outcome - the proof system caught an unauthorized capability use. The UI must surface this as failure of the proof, not failure of the test."
  },
  "capabilities_declared":  ["&body.browser"],
  "capabilities_attempted": ["&body.browser", "&body.os"]
}
